{
  "schemaVersion": "1.0.0",
  "cardId": "TEST-043U-001",
  "revision": 1,
  "status": "approved",
  "promptVersion": "DentProtocol BY v6.0",
  "formTemplateVersion": "Форма 043/у, пустой бланк v6",
  "clinicId": "LK-DENT-TEST",
  "doctorId": "DOCTOR-TEST",
  "patient": {
    "patientId": "PATIENT-TEST-001",
    "lastName": "Тестовый",
    "firstName": "Пациент",
    "middleName": null,
    "birthDate": null,
    "sex": "unknown",
    "phone": null,
    "address": null
  },
  "visit": {
    "visitId": "VISIT-TEST-001",
    "dateTime": "2026-08-17T12:00:00+03:00",
    "patientType": "primary",
    "specialty": "orthopedics",
    "sourceDictation": "Обезличенный тестовый случай комплексного ортопедического лечения."
  },
  "clinicalRecord": {
    "complaints": "Эстетические нарушения, отсутствие зубов и нарушение функции жевания с обеих сторон.",
    "presentIllness": "Ранее проводилось терапевтическое и эндодонтическое лечение. Обратился для комплексного восстановления эстетики и функции жевания несъемными ортопедическими конструкциями.",
    "generalHealth": "Со слов пациента без особенностей.",
    "generalHealthChecklist": [
      { "condition": "cardiovascular", "answer": "no", "details": null },
      { "condition": "nervous", "answer": "no", "details": null },
      { "condition": "endocrine", "answer": "no", "details": null },
      { "condition": "digestive", "answer": "no", "details": null },
      { "condition": "respiratory", "answer": "no", "details": null },
      { "condition": "infectious", "answer": "no", "details": null },
      { "condition": "allergy", "answer": "no", "details": null },
      { "condition": "regular_medication", "answer": "no", "details": null },
      { "condition": "occupational_hazard", "answer": "no", "details": null },
      { "condition": "pregnancy_postpartum", "answer": "no", "details": null },
      { "condition": "other", "answer": "no", "details": null }
    ],
    "externalExamination": "Лицо симметрично. Открывание рта свободное. Признаков дисфункции ВНЧС не выявлено.",
    "externalExamDetails": {
      "faceConfiguration": "не изменена, лицо симметрично",
      "skinAndLips": "обычной окраски, без видимых патологических изменений",
      "lymphNodes": "не увеличены, при пальпации безболезненны",
      "tmj": "открывание рта свободное, движения плавные, безболезненные"
    },
    "bite": "Без видимых особенностей.",
    "dentalConditionText": "Пломбы: 11, 12, 14, 15, 16, 21, 22, 24, 25, 27, 32, 38, 41, 42. После эндодонтического лечения: 12, 21, 22, 24, 25, 38. Кариес 17. Зубы 26, 28, 31, 35, 36, 46, 48 отсутствуют. В области 37 - сохранившийся корень.",
    "periodontium": "Десна бледно-розовая, плотно прилегает к шейкам зубов. Видимых признаков воспаления и патологической кровоточивости не выявлено.",
    "oralMucosa": "Слизистая оболочка бледно-розовая, умеренно увлажнена, без видимых патологических элементов и нарушения целостности.",
    "dentalFormula": [
      { "fdi": 18, "presence": "present", "basis": "natural_tooth", "conditions": ["intact"], "vitality": "unknown", "canalsNormal": null, "destructionFraction": null, "plannedConstruction": null, "note": null, "source": "doctor" },
      { "fdi": 17, "presence": "present", "basis": "natural_tooth", "conditions": ["caries"], "vitality": "unknown", "canalsNormal": null, "destructionFraction": null, "plannedConstruction": null, "note": null, "source": "doctor" },
      { "fdi": 16, "presence": "present", "basis": "natural_tooth", "conditions": ["filling"], "vitality": "vital", "canalsNormal": null, "destructionFraction": null, "plannedConstruction": "zirconia_crown", "note": null, "source": "doctor" },
      { "fdi": 15, "presence": "present", "basis": "natural_tooth", "conditions": ["filling"], "vitality": "vital", "canalsNormal": null, "destructionFraction": null, "plannedConstruction": "zirconia_crown", "note": null, "source": "doctor" },
      { "fdi": 14, "presence": "present", "basis": "natural_tooth", "conditions": ["filling"], "vitality": "vital", "canalsNormal": null, "destructionFraction": null, "plannedConstruction": "zirconia_crown", "note": null, "source": "doctor" },
      { "fdi": 13, "presence": "present", "basis": "natural_tooth", "conditions": ["intact"], "vitality": "vital", "canalsNormal": null, "destructionFraction": null, "plannedConstruction": "zirconia_crown", "note": null, "source": "doctor" },
      { "fdi": 12, "presence": "present", "basis": "natural_tooth", "conditions": ["filling", "post_endo"], "vitality": "post_endo", "canalsNormal": true, "destructionFraction": null, "plannedConstruction": "zirconia_crown", "note": null, "source": "doctor" },
      { "fdi": 11, "presence": "present", "basis": "natural_tooth", "conditions": ["filling"], "vitality": "vital", "canalsNormal": null, "destructionFraction": null, "plannedConstruction": "zirconia_crown", "note": null, "source": "doctor" },
      { "fdi": 21, "presence": "present", "basis": "natural_tooth", "conditions": ["filling", "post_endo"], "vitality": "post_endo", "canalsNormal": null, "destructionFraction": 0.6, "plannedConstruction": "zirconia_crown", "note": null, "source": "doctor" },
      { "fdi": 22, "presence": "present", "basis": "natural_tooth", "conditions": ["filling", "post_endo"], "vitality": "post_endo", "canalsNormal": true, "destructionFraction": 0.6, "plannedConstruction": "zirconia_crown", "note": null, "source": "doctor" },
      { "fdi": 23, "presence": "present", "basis": "natural_tooth", "conditions": ["intact"], "vitality": "vital", "canalsNormal": null, "destructionFraction": null, "plannedConstruction": "zirconia_crown", "note": null, "source": "doctor" },
      { "fdi": 24, "presence": "present", "basis": "natural_tooth", "conditions": ["filling", "post_endo"], "vitality": "post_endo", "canalsNormal": true, "destructionFraction": 0.6, "plannedConstruction": "zirconia_crown", "note": null, "source": "doctor" },
      { "fdi": 25, "presence": "present", "basis": "natural_tooth", "conditions": ["filling", "post_endo"], "vitality": "post_endo", "canalsNormal": true, "destructionFraction": 0.6, "plannedConstruction": "bridge_support", "note": null, "source": "doctor" },
      { "fdi": 26, "presence": "absent", "basis": "none", "conditions": [], "vitality": null, "canalsNormal": null, "destructionFraction": null, "plannedConstruction": "pontic", "note": null, "source": "doctor" },
      { "fdi": 27, "presence": "present", "basis": "natural_tooth", "conditions": ["filling"], "vitality": "vital", "canalsNormal": null, "destructionFraction": null, "plannedConstruction": "bridge_support", "note": null, "source": "doctor" },
      { "fdi": 28, "presence": "absent", "basis": "none", "conditions": [], "vitality": null, "canalsNormal": null, "destructionFraction": null, "plannedConstruction": null, "note": null, "source": "doctor" },
      { "fdi": 48, "presence": "absent", "basis": "none", "conditions": [], "vitality": null, "canalsNormal": null, "destructionFraction": null, "plannedConstruction": null, "note": null, "source": "doctor" },
      { "fdi": 47, "presence": "present", "basis": "natural_tooth", "conditions": ["intact"], "vitality": "vital", "canalsNormal": null, "destructionFraction": null, "plannedConstruction": "bridge_support", "note": null, "source": "doctor" },
      { "fdi": 46, "presence": "absent", "basis": "none", "conditions": [], "vitality": null, "canalsNormal": null, "destructionFraction": null, "plannedConstruction": "pontic", "note": null, "source": "doctor" },
      { "fdi": 45, "presence": "present", "basis": "natural_tooth", "conditions": ["intact"], "vitality": "vital", "canalsNormal": null, "destructionFraction": null, "plannedConstruction": "bridge_support", "note": null, "source": "doctor" },
      { "fdi": 44, "presence": "present", "basis": "natural_tooth", "conditions": ["intact"], "vitality": "vital", "canalsNormal": null, "destructionFraction": null, "plannedConstruction": "zirconia_crown", "note": null, "source": "doctor" },
      { "fdi": 43, "presence": "present", "basis": "natural_tooth", "conditions": ["intact"], "vitality": "vital", "canalsNormal": null, "destructionFraction": null, "plannedConstruction": "zirconia_crown", "note": null, "source": "doctor" },
      { "fdi": 42, "presence": "present", "basis": "natural_tooth", "conditions": ["filling"], "vitality": "vital", "canalsNormal": null, "destructionFraction": null, "plannedConstruction": "bridge_support", "note": null, "source": "doctor" },
      { "fdi": 41, "presence": "present", "basis": "natural_tooth", "conditions": ["filling"], "vitality": "vital", "canalsNormal": null, "destructionFraction": null, "plannedConstruction": "bridge_support", "note": null, "source": "doctor" },
      { "fdi": 31, "presence": "absent", "basis": "none", "conditions": [], "vitality": null, "canalsNormal": null, "destructionFraction": null, "plannedConstruction": "pontic", "note": null, "source": "doctor" },
      { "fdi": 32, "presence": "present", "basis": "natural_tooth", "conditions": ["filling"], "vitality": "vital", "canalsNormal": null, "destructionFraction": null, "plannedConstruction": "bridge_support", "note": null, "source": "doctor" },
      { "fdi": 33, "presence": "present", "basis": "natural_tooth", "conditions": ["intact"], "vitality": "vital", "canalsNormal": null, "destructionFraction": null, "plannedConstruction": "bridge_support", "note": null, "source": "doctor" },
      { "fdi": 34, "presence": "present", "basis": "natural_tooth", "conditions": ["intact"], "vitality": "vital", "canalsNormal": null, "destructionFraction": null, "plannedConstruction": "zirconia_crown", "note": null, "source": "doctor" },
      { "fdi": 35, "presence": "absent", "basis": "none", "conditions": [], "vitality": null, "canalsNormal": null, "destructionFraction": null, "plannedConstruction": "implant_bridge_pontic", "note": null, "source": "doctor" },